"November 08, 2014 at 05:47PM",Artist: Dot Allison,Track: Colour Me,Album: Afterglow,,http://ift.tt/1eQUIuy
"November 08, 2014 at 05:51PM",Artist: Thievery Corporation,Track: Beautiful Drug,Album: Radio Retaliation,,http://ift.tt/HELGS8
"November 08, 2014 at 05:55PM",Artist: Bonobo,Track: Days To Come,Album: Days to Come,,http://ift.tt/z1M6gL
"November 08, 2014 at 05:59PM",Artist: Télépopmusik,Track: Don't Look Back,Album: The L Word: The Third Season (Soundtrack),,http://ift.tt/PO03pK
"November 08, 2014 at 06:03PM",Artist: Charles Webster,Track: The Gift of Freedom,Album: Remixed on the 24th of July,,http://ift.tt/UK6Qnd
"November 08, 2014 at 06:27PM",Artist: Tom Middleton,Track: Serendipity,Album: Lifetracks,,http://ift.tt/xZ2IKN
"November 08, 2014 at 06:32PM",Artist: Tripssono,Track: Triptango (Trip Hop Remix),"Album: Tango Chill Sessions, Vol. 2",,http://ift.tt/JoO0xH
"November 08, 2014 at 06:36PM",Artist: Morcheeba,Track: Everybody Loves a Loser,Album: The Antidote,,http://ift.tt/1h12dSS
"November 08, 2014 at 06:41PM",Artist: Nightmares on Wax,Track: Rise,Album: Smokers Delight,,http://ift.tt/1khbyrW
"November 08, 2014 at 06:46PM",Artist: Thom Yorke,Track: Black Swan,Album: The Eraser,,http://ift.tt/pvj4Xm
"November 09, 2014 at 07:42PM",Artist: Ratatat,Track: Brulee,Album: LP3,,http://ift.tt/Ywvfm5
"November 09, 2014 at 07:46PM",Artist: Two Fingers,Track: Fools Rhythm,Album: Stunt Rhythms,,http://ift.tt/A6CNi3
"November 09, 2014 at 07:50PM",Artist: John Frusciante,Track: Murderers,Album: To Record Only Water For Ten Days,,http://ift.tt/W1Cnnr
"November 09, 2014 at 07:53PM",Artist: J-Walk,Track: Soul Vibration,Album: The Best Of 15 Years Supperclub,,http://ift.tt/J8VPvx
"November 09, 2014 at 07:56PM",Artist: Amon Tobin,Track: At the End of the Day,Album: Foley Room,,http://ift.tt/O8Pa6U
"November 11, 2014 at 10:30AM",Artist: Hard-Fi,Track: Better Do Better,Album: Stars of CCTV,,http://ift.tt/usnwSL
"November 11, 2014 at 12:17PM",Artist: Hard-Fi,Track: Living For The Weekend,Album: Stars of CCTV,,http://ift.tt/UQIUnj
"November 11, 2014 at 01:00PM",Artist: Kasabian,Track: Underdog,Album: West Ryder Pauper Lunatic Asylum,,http://ift.tt/n3ecPN
"November 11, 2014 at 01:04PM",Artist: Keane,Track: Somewhere Only We Know,Album: Hopes and Fears,,http://ift.tt/p6RmNn
"November 11, 2014 at 01:08PM",Artist: The Killers,Track: All These Things That I've Done,Album: Hot Fuss,,http://ift.tt/z1Y6Lh
"November 11, 2014 at 01:13PM",Artist: Bloc Party,Track: So Here We Are,Album: Silent Alarm (Explicit),,http://ift.tt/nHF3Uk
"November 11, 2014 at 01:18PM",Artist: Hard-Fi,Track: Bring It On,Album: Killer Sounds,,http://ift.tt/1dJPZ12
"November 11, 2014 at 01:22PM",Artist: Kasabian,Track: I.D.,Album: Kasabian,,http://ift.tt/rm8v4Z.
"November 11, 2014 at 01:27PM",Artist: Carolina Liar,Track: I'm Not Over,Album: Coming To Terms,,http://ift.tt/oiL8CU
"November 11, 2014 at 01:30PM",Artist: Rock Kills Kid,Track: I Need You,Album: Are You Nervous?,,http://ift.tt/14aaHXl
"November 11, 2014 at 01:35PM",Artist: Kaiser Chiefs,Track: Oh My God,Album: Employment,,http://ift.tt/w6Q8DH
"November 11, 2014 at 01:39PM",Artist: Muse,Track: Supermassive Black Hole,Album: Black Holes and Revelations,,http://ift.tt/pxs7Al
"November 11, 2014 at 01:42PM",Artist: The Kooks,Track: Naïve,Album: Inside In / Inside Out,,http://ift.tt/qWIIIC
"November 11, 2014 at 01:45PM",Artist: Franz Ferdinand,Track: Can't Stop Feeling,Album: Tonight:Franz Ferdinand,,http://ift.tt/znARgz
"November 11, 2014 at 01:49PM",Artist: Hard-Fi,Track: Stay Alive,Album: Killer Sounds,,http://ift.tt/KKLLVl
"November 11, 2014 at 01:53PM",Artist: The Killers,Track: When You Were Young,Album: When You Were Young,,http://ift.tt/ubAaxw
"November 11, 2014 at 01:57PM",Artist: Razorlight,Track: Golden Touch,Album: Up All Night,,http://ift.tt/K9IiyM
"November 11, 2014 at 04:44PM",Artist: Muse,Track: Time Is Running Out,Album: Absolution,,http://ift.tt/qhzICf
"November 11, 2014 at 04:48PM",Artist: The Temper Trap,Track: Sweet Disposition,Album: Conditions,,http://ift.tt/re7ny7
"November 11, 2014 at 04:52PM",Artist: Bloc Party,Track: Ion Square,Album: Intimacy,,http://ift.tt/IZpSoW
"November 11, 2014 at 04:59PM",Artist: Hard-Fi,Track: Tied Up Too Tight,Album: Cash Machine EP,,http://ift.tt/PGWEco
"November 11, 2014 at 05:05PM",Artist: Kasabian,Track: Running Battle,Album: Kasabian,,http://ift.tt/uWdloE
"November 11, 2014 at 05:09PM",Artist: Modest Mouse,Track: Dashboard,Album: We Were Dead Before The Ship Even Sank,,http://ift.tt/u4BUTY
"November 11, 2014 at 05:13PM",Artist: Franz Ferdinand,Track: Come On Home,Album: Franz Ferdinand,,http://ift.tt/z29RDv
"November 11, 2014 at 05:17PM",Artist: Hard-Fi,Track: Middle Eastern Holiday,Album: Stars of CCTV,,http://ift.tt/1hqXuuP
"November 11, 2014 at 05:21PM",Artist: Kasabian,Track: Ovary Stripe,Album: Kasabian,,http://ift.tt/vE7isT
"November 11, 2014 at 05:25PM",Artist: Rooney,Track: I'm Shakin',Album: Rooney,,http://ift.tt/YS0Ccb
"November 12, 2014 at 02:18PM",Artist: Ratatat,Track: Loud Pipes,Album: Classics,,http://ift.tt/ug1ni4
"November 12, 2014 at 02:23PM",Artist: Ernest Gonzales,Track: Life Is But a Dream,Album: While On Saturns Rings,,http://ift.tt/1jsBK66
"November 12, 2014 at 02:26PM",Artist: The Sound Defects,Track: Take Out,Album: The Iron Horse,,http://ift.tt/KTw4i8
"November 12, 2014 at 02:31PM",Artist: Marlena Shaw,Track: California Soul (Diplo/Mad Decent Remix),"Album: Verve Remixed, Vol.4",,http://ift.tt/1fNHzWT
"November 12, 2014 at 02:35PM",Artist: Necro,Track: Black Helicopters (Instrumental),Album: Instrumentals Vol.1,,http://ift.tt/1sjYtSP
"November 12, 2014 at 02:40PM",Artist: Rob Dougan,Track: Clubbed to Death (Kurayamino Variation),Album: Furious Angels,,http://ift.tt/vUjlzT
"November 12, 2014 at 02:47PM",Artist: Ratatat,Track: Nostrand,Album: Classics,,http://ift.tt/sanJqk
"November 12, 2014 at 02:51PM",Artist: Gramatik,Track: The Unfallen Kingdom,Album: Water 4 The Soul EP,,http://ift.tt/xeWhcp
"November 12, 2014 at 02:54PM",Artist: Moondog,Track: Bird's Lament,Album: DJ Kicks,,http://ift.tt/zLa4E2
"November 12, 2014 at 02:58PM",Artist: Parov Stelar,Track: Baska Brother,Album: The Paris Swing Box - EP,,http://ift.tt/wYDhvo
"November 12, 2014 at 03:03PM",Artist: Ratatat,Track: Crips,Album: Ratatat,,http://ift.tt/1g5th1t
"November 12, 2014 at 03:07PM",Artist: Dusty Brown,Track: The City is Killing Me,Album: This City Is Killing Me,,http://ift.tt/V3FiKj
"November 12, 2014 at 03:11PM",Artist: Blockhead,Track: Insomniacs Olympics,Album: Zentertainment 2004,,http://ift.tt/H45qAO
"November 12, 2014 at 03:15PM",Artist: FC/Kahuna,Track: Hayling,Album: Machine Says Yes,,http://ift.tt/KjNXTj
"November 12, 2014 at 03:36PM",Artist: SomethingALaMode,Track: SchubertALaMode,Album: SomethingALaMode,,http://ift.tt/1ppR4h7
"November 12, 2014 at 03:42PM",Artist: Wax Tailor,Track: Que Sera,Album: Tales of the Forgotten Melodies,,http://ift.tt/YbZik4
"November 12, 2014 at 03:45PM",Artist: Ancient Astronauts,Track: I Came Running,Album: We Are To Answer,,http://ift.tt/17mPSq9
"November 12, 2014 at 06:27PM",Artist: Gramatik,Track: Orchestrated Incident,Album: Street Bangerz Volume 2,,http://ift.tt/ttETsU
"November 12, 2014 at 06:30PM",Artist: Bonobo,Track: Ketto,Album: Days to Come,,http://ift.tt/wZJEzq
"November 12, 2014 at 06:35PM",Artist: Passion Pit,Track: Sleepyhead,Album: Manners,,http://ift.tt/tM5uJJ
"November 12, 2014 at 06:38PM",Artist: Mutemath,Track: Collapse,Album: Mute Math,,http://ift.tt/1plgLEC
"November 12, 2014 at 06:40PM",Artist: Wax Tailor,Track: Say Yes (Instrumental Mix),Album: Say Yes (Single),,http://ift.tt/10PzVVH
"November 12, 2014 at 06:43PM",Artist: Ratatat,Track: Wildcat,Album: Classics,,http://ift.tt/u1uyxs
"November 16, 2014 at 06:09PM",Artist: Morcheeba,Track: Get Along (feat. Pace Won),Album: Charango,,http://ift.tt/1xMVVjK
"November 16, 2014 at 06:12PM",Artist: Nina Simone,Track: Feeling Good,Album: I Put A Spell On You,,http://ift.tt/uOC95r
"November 16, 2014 at 06:15PM",Artist: Tosca,Track: Joe Si Ha,Album: No Hassle,,http://ift.tt/HSIKpI
"November 16, 2014 at 06:20PM",Artist: Everything But the Girl,Track: Single (Brad Wood Memphis remix),Album: Adapt Or Die - Ten Years Of Remixes,,http://ift.tt/1A8PNFX
"November 16, 2014 at 06:25PM",Artist: Blackmill,Track: Let It Be,Album: Miracle,,http://ift.tt/S0mmk4
"November 16, 2014 at 06:31PM",Artist: Slow Train Soul,Track: Mississippi Freestylin',Album: Santimanitay,,http://ift.tt/1eCPV6Z
"November 16, 2014 at 06:36PM",Artist: Morcheeba,Track: Recipe For Disaster,Album: Blood Like Lemonade,,http://ift.tt/U1Fg8J
"November 18, 2014 at 03:23PM",Artist: Munk 777,Track: Someone Told Me,Album: Ibiza Lounge,,http://ift.tt/14HCLS8
"November 18, 2014 at 03:28PM",Artist: Phobos (Electronica),Track: Edge Of Forever,Album: Frequent Flyer: Departure Lounge,,http://ift.tt/TitrvX
"November 18, 2014 at 03:32PM",Artist: Shawn Lee's Ping Pong Orchestra,Track: Kiss the Sky,Album: Voices & Choices,,http://ift.tt/zk5N4d
"November 18, 2014 at 03:36PM",Artist: Josh One,Track: Narrow Path,Album: Narrow Path,,http://ift.tt/KcdBRk
"November 18, 2014 at 03:41PM",Artist: Bonobo,Track: Kong,Album: Black Sands,,http://ift.tt/tXt2nJ
"November 18, 2014 at 03:46PM",Artist: Hooverphonic,Track: Mad About You,Album: Magnificent Tree,,http://ift.tt/n0i0J4
"November 18, 2014 at 03:50PM",Artist: Radio Citizen,Track: El Cielo,Album: Berlin Serengeti,,http://ift.tt/SiRVpE
"November 18, 2014 at 03:53PM",Artist: Flunk,Track: Morning Star (Parliavox remix),Album: The Departure Lounge: Lounge,,http://ift.tt/1iO6uKq
"November 18, 2014 at 03:58PM",Artist: Morcheeba,Track: Blue Chair,Album: Dive Deep,,http://ift.tt/R5M71T
"November 18, 2014 at 04:03PM",Artist: Mama Oliver,Track: Eastwest (Stoned Together),Album: Kruder & Dorfmeister: the k&d sessions,,http://ift.tt/tjqr7i
"November 18, 2014 at 04:08PM",Artist: Tosca,Track: Every Day + Every Night (feat. Sugar B.),Album: Dehli9,,http://ift.tt/10SpyPJ
"November 18, 2014 at 04:14PM",Artist: Lenny MacDowell,Track: Ain't No Sunshine,Album: Seriously Good Music: Lounge,,http://ift.tt/1Afl6xU
"November 18, 2014 at 04:19PM",Artist: Moby,Track: Run On,Album: Play,,http://ift.tt/uLcw2b